{"schema":"tessera.verdict/1","protocol":"tessera-protocol/1","params":"test-small/1","test_parameters":true,"anchor_verified":false,"ledger_updated":false,"zero_knowledge":false,"digests":{"statement":"9b575af61cde8d91b8fbcb26fd91d7d5f031ca0640d4e1020bbd79264d4c5440","claim_list":"3622d663c0652d5335fe278779a151c19ed31ebab02904f3cfd9bccaafe4ef8b","weights":"6b370c088608a47de0d4c0dbb225e3bf5d9f3bb34e155ddccd31ec6f38b8db15","manifest":"0000000000000000000000000000000000000000000000000000000000000000"},"checks":[{"step":1,"check":"input","outcome":"pass","duration_ns":null},{"step":2,"check":"params","outcome":"pass","duration_ns":null},{"step":3,"check":"claims","outcome":"pass","duration_ns":null},{"step":4,"check":"statement","outcome":"pass","duration_ns":null},{"step":5,"check":"weight_reservation","outcome":"not_applicable","duration_ns":null},{"step":6,"check":"transcript","outcome":"pass","duration_ns":null},{"step":7,"check":"leaf","outcome":"pass","duration_ns":null},{"step":8,"check":"stages","outcome":"pass","duration_ns":null},{"step":9,"check":"evaluations","outcome":"pass","duration_ns":null},{"step":10,"check":"queries","outcome":"pass","duration_ns":null},{"step":11,"check":"columns","outcome":"pass","duration_ns":null},{"step":12,"check":"exact_bound","outcome":"pass","duration_ns":null},{"step":13,"check":"complete","outcome":"pass","duration_ns":null}],"requests":[{"request_id":0,"uhat_fixed":0}],"batch_uhat_fixed":0,"verdict":{"status":"accept"}}
